world,science,uk,us,teesside,tyneside,sunderland,worcester,bedford,norwich,west_yorkshire,plymouth,india,brazil,turkey,uk_politics,technology
Body parts of missing Australian fisherman found inside two crocodiles,Can you solve it? Succession,UK's Ofcom investigates Royal Mail over missed delivery targets,U.S. Postal chief vows more 'aggressive actions' after missing financial target,,Business Supplement: Northern Law Awards 2019,Speed camera officer debunks mobile camera van myths,Plans in place to create a Worcester Warriors Supporters Trust,,Jewellery artist inspired by coastal beauty of Sweden's islands opens city shop,Leeds forward Tetevano handed two-game ban,Kennedy set for Europeans a year after cancer diagnosis,‘Inspired by local crime shows’: 3 minors kill their 12-year-old friend in MP’s Seoni,,,Top Tory donor with ties to multi-million money laundering probe,'World's first' driverless bus service doesn't quite live up to the hype
Tribe that worships Prince Philip to hold ‘big’ Coronation party,Did you solve it? Chicken or egg,London stocks reverse gains as financial and energy stocks dip; Vodafone slides,US court halts ruling blocking Obamacare for some preventive healthcare,,Millennium Bridge to be turned into glowing display for local firms,Martin Lewis warns minimum wage workers of seven ways they could be 'underpaid',City's new wildlife corridor gets official launch at country park,,Plans finally revealed for long empty former furniture store,Bradford win first leg of League Two play-off semi,National League pushes for more promotion spots,"As UP govt plans to table 1980 riot report, in Moradabad, open wounds from an Eidgah clash",,,Bill of Rights under threat as new justice secretary launches review,Google unveils its first folding phone - with an eye-watering price tag
Crocodile may have eaten fisherman after flip flops found on riverbank,Can you solve it? Chicken or egg,"London stocks start week strong as banks, miners rise",Republican allies form Super PAC to back Pence presidential bid,,GUILTY: Teenager convicted of terrorism plot to start race war,Virgin Media is offering free Xbox consoles worth £250 - here's how to get one,Man recently jailed for crime spree is back before Worcester magistrates,,Concern around potentially toxic chemicals sprayed on development site,National League pushes for more promotion spots,Argyle ready to have lowest budget in Championship,"Unable to pay for ambulance, Bengal man travels in bus with child’s body",,,Braverman told to ‘stick to job’ amid leadership bid fears,"U.S. charges Apple ex-employee for trying to steal technology, fleeing to China"
Angry Red Sea ship survivors ‘threaten owners to get compensation’,‘Absolutely gargantuan’: astrophysicist explains largest cosmic explosion ever witnessed – video,Sterling falls as cracks appear in Britain's job market,Three in four Americans worry default could hurt them,,Tracker helped police recover scooter stolen from Durham car park,Martin Lewis explains how 'pimping your pension' with key steps could help you gain thousands,Worcester school girls try out alternative sports,,Speeder given night time curfew after giving police the finger,Durham beat Yorkshire by one wicket in thriller,Brown one of three players released by Exeter City,The remarkable reinvention of cricket icon Dhoni at 41,,,Suella Braverman’s most controversial quotes,OpenAI chief concerned about AI being used to compromise elections
South Africa ‘sent weapons and ammunition to Russia’ in clandestine port transfer,SpaceX Starship rocket blows up minutes after launch – video,Two poultry workers test positive for bird flu after contact on infected farm,U.S. charges Chinese national with providing weapons materials to Iran,,Security man who 'found' hoax bomb at County Durham pub wanted to be a hero,Britain's Got Talent judges left emotional after 13-year-old puts on magical audition,Top five Chicken Shops in Worcester according to Google reviews,,New bus line expansion to connect city centre with fast expanding areas,,Mayor among five to leave champions Argyle,Dozens held in India after Islamic State film row,,,Police investigate MP Julian Knight over sexual assault allegation,EU states approve world's first comprehensive crypto rules
"Sudan’s Presidential Palace damaged in fighting, claims RSF",Total solar eclipse 2023: rare hybrid eclipse reaches totality over Western Australia – video,'Bubbly' mum-of-four and man found dead named by police,"US on track for June 1 default without debt ceiling hike, Treasury says ",,Jury retires to consider verdict in teenage terror suspect trial,13 North East World War I heroes and how they won their VCs in the heat of battle,Popular food pop-ups coming to Worcester cricket club,,Deli leaves farm near Norwich with replacement to be announced,,,The life of India's gangster-politician killed on live TV,,,Who are the ‘National Conservatives’ and what do they stand for?,U.S. forms team to set strategy on flying air taxis
The unusual animal that may have the answer to ‘superbugs’,Study shows how a short nap can be used to unlock creativity,Princess of Wales loses game to Olympic legend,ChatGPT boss urges US Congress to regulate AI,,Eating Out Review: We tried St Sushi in Newcastle City Centre and here's our verdict,Doorman jailed after planting fake bomb at Seaham pub to 'look like a hero',University to bloom with pretty new wildflower meadow,,City athlete who had a heart transplant brings home the gold,,,Titans seal play-off spot as Sunrisers eliminated,,,"Foreign staff needed to tackle food prices, industry chiefs tell No 10","Tesla succession plan, vehicle demand in focus at annual meet"
"'Messi, we are waiting for you': Gangs target footballer's family's businesses",New water treatment zaps forever chemicals ‘once and for all’,Prince Harry in legal row with Home Office over his security,Report criticises FBI's Trump-Russia inquiry,,"DNA test advances helped to snare Nikki Allan's killer, in Sunderland, trial was told",Bird watcher's tide warning after dramatic cliff rescue near Marsden Grotto,"Oldest, strangest and most beautiful pubs in Worcestershire",,Dozens of water butts given to city community gardens,,,The daring riders of India's 'well of death',,,One in five will be paying higher income tax rate by 2027,China's Baidu beats earnings estimates as chatbot awaits govt approval
"Sorry our ill-disciplined cartel members kidnapped and killed US tourists, say Mexican 'Scorpion' gang leaders","Early life adversity sees most species suffer later on, but not gorillas – study",McDonald's manager contradicts ex-PC's evidence about Wayne Couzens' flashing,Rudy Giuliani sued over sexual harassment claims,,Sentencing hearing for Nikki Allan's killer may be televised at court in Newcastle,Sunderland unchanged as key men recover in time for play-off semi-final second leg at Luton,Pubs and bars in Worcester where you can watch Eurovision 2023,,Controversial 5G mast plans to go ahead despite calls to move it,,,Umpire's 'soft signal' to be scrapped by ICC,,,James Cleverly gives evidence on post-Brexit trade rules for NI,"SAP raises 2025 outlook, launches 5 bln euro share buyback"
Dispatch: The desperate rush to reach the US border as end of Title 42 restrictions looms,Scientist breaks world record by spending 74 days living underwater ,Tories face questions over tycoon donor named in money laundering case,US starts drug trial for dirty-bomb antidote,,Nikki Allan trial: Jury retires to consider its verdict in 30-year-old murder case,"How to buy Championship play-off final tickets, when is the final and kick-off time",Thief returned to bad habits stealing throw robe from clothes shop,,Pope gives blessing to mark 650-year anniversary of Norwich mystic,,,Opposition Congress wins Karnataka election,,,Farage admits Brexit has ‘failed’ ,Google to delete inactive accounts starting December
How Turkey's opposition is taking the taboo out of the headscarf debate ,"Humans are leaving their DNA everywhere, scientists find",Trio jailed after investigators smashed 20-year global passport scam,The secret race through Death Valley,,'Touched the lives of so many': Police horse and police dog die as force pays tribute,"All of the North East pubs, restaurants and takeaways with zero food hygiene ratings",Best bakery in Worcestershire - Peter Cooks Bread rises to the occasion again,,Jack Whitehall adds another two shows to Norwich leg of tour due to demand,,,"India's 10,000 forgotten mansions",,,Proposed amendment to Online Safety Bill to address misogynistic abuse online,Two online brokerages to remove China apps as Beijing data crackdown widens
Why the China scandal may be Justin Trudeau's most damaging yet,Researchers identify rare genetic resilience to Alzheimer’s disease – study,The main reasons why food prices are rising so much,Rushdie warns free expression is under threat,,"'Railways work for people, not profit': MPs on national train firm being nationalised",Smyths Toys shoppers can get free LEGO this Saturday in special giveaway event,TRAVEL ALERT: M5 closed tonight near Worcester for carriageway improvements,,"NHS dentistry at risk of collapse, MP tells debate",,,'I lost 11 family members in Kerala boat accident',,,Sunak says international system for human trafficking ‘not working’,iDEAL Semiconductor targets cheaper electric car chips with $40 mln funding
Miller Lite defends 'woke' advert saying 'women shouldn't have to mud-wrestle to sell beer',Ancient meteorites provide ‘ground-breaking insight’ on formation of Jupiter,Heatwave rumours: What the weather is forecast to be this weekend and looking further ahead,Watch: Shark comes out of nowhere and rams kayaker,,Man who groomed and raped 15-year-old girl jailed after she 'bravely' reported attack,Tracker helped police recover scooter stolen from Durham car park,Figures released on impact of Voter ID on Worcester's local elections,,One of three tiger cubs born at zoo dies,,,'Desi pubs are a multicultural success story',,,Defence minister refuses to give lifeline to Afghan war hero,Software AG minority investor groups to oppose Silver Lake delisting
Cannes boss defends Depp's festival presence saying he didn't care about Heard trial,Study reveals how different types of obesity are linked to cancer,Police to use live facial recognition in city centre for start of Beyonce's UK tour,"Martha Stewart, 81, is Sports Illustrated cover star",,Nikki Allan murder trial: Jury expected to retire to consider its verdict on Friday,Security man who 'found' hoax bomb at County Durham pub wanted to be a hero,Chance to have your say on Worcester's community hubs,,Water quality issue sees beaches lose Blue Flags,,,Why a film on Islamic State is so controversial,,,Zelensky needs allies to go further and faster over weapons and jets,Ubisoft posts record operating loss in year to March but sticks to FY guidance
Miller Lite defends 'controversial' beer advert celebrating women,Talking to toddlers boosts early brain development – scientists,Police investigate MP accused of serious sexual assault,Ukraine war: Trump is 'untethered to reality',,Stephen Tompkinson cleared of inflicting grievous bodily harm in noise row,Man jailed for Greggs' ram raid and County Durham house burglary on successive nights,Worcester acquisition is latest move in GMP Recruitment growth plan,,Roads reopened after leak at major UK gas terminal,,,India’s booming population needs more women at work,,,Braverman warns against Tory infighting amid tensions on immigration,China's Baidu confident its AI chatbot won't make mistakes on 'sensitive topics'
"Pence plans 'Reagan coalition' of evangelicals, fiscal conservatives and hawks for White House run",First baby with DNA from three people born in the UK,"Former Mirror chair did 'nothing' after hacking warning, Prince Harry trial hears",What does the 14th amendment have to do with the debt ceiling?,,Stephen Tompkinson gbh trial jury to resume deliberations tomorrow,University scientists pioneer link between sea-swimming and health benefits,Pop-up stall in Worcester will shed light on fostering during Foster Care Fortnight,,"Barbie film: It was fun, fake tan and big wigs",,,Crowds swarm Imran Khan as he arrives at court,,,"PM says bill to try and stop small boat crossings 'novel, ambitious' and 'compliant with international obligations' | Politics latest","WHO warns against bias, misinformation in using AI in healthcare"
Macron follows Britain by sending more missiles to Ukraine,New study suggests feeling hungry could be linked to slower ageing,Greggs wins battle to sell late-night sausage rolls in London's Leicester Square,Tom Hanks: My career could go on forever with AI,,Teenage terror suspect 'fantasised' about blowing up police station to start race war,Family who pocketed £2m from website scam sentenced to 21 years,Council thumbs up for 19 new homes on the edge of Worcester,,Crisp packet from 1960s found on beach,,,Pakistan minister: It's India's call on peace talks,,,Sunak calls for change to international law that experts think government will break,Comcast likely to sell Hulu stake to Disney by early 2024 - CNBC
Ukraine says it downed Russian hypersonic missiles during ‘exceptional’ air attack on Kyiv,Research warns AI may be ‘Great Filter’ that wipes out humans,Lucy Letby text messages shown to court - as she explains why she took photo of sympathy card to dead baby's parents | Murder trial latest,Congressional staffers attacked with baseball bat,,Nikki Allan death: Accused Stockton man lacks 'courage' to give evidence in court,"Police confirm body of man, 34, is found following search for missing North East man",WE'RE HIRING: Web Development and Social Media Platforms Manager,,Transgender driver lauds 'warm welcome' at race,,,India Parkinson's patients find joy through dance,,,Tories face questions over tycoon donor named in money laundering case,UK's competition boss: We do not want a hostile environment for tech
Parliament spokesperson says one of Libya’s rival administrations suspends prime minister,Hammerhead sharks ‘hold their breath to stay warm when diving into cold waters’,'It's the hungry scream': Desperate parents stealing baby formula to feed their children,Why Ryan Reynolds wanted to buy this ice hockey team,,Why comedian Ross Noble pointed a British Army tank at his neighbour's house,Schoolchildren get on board for railway station mural art project,Free online seminars to raise awareness and understanding of hoarding during National Hoarding Awareness Week,,Council reprimanded over personal data requests,,,The moment a crane in Indian zoo met its human friend,,,Police investigate MP accused of serious sexual assault,Factbox: Amgen-Horizon deal joins mega mergers facing regulatory heat
"Putin, Zelenskyy agree to meet with ‘African leaders peace mission,’ says South Africa president",Study finds key process everyone can follow to prevent Alzheimer’s,Facebook and Instagram owner launches paid verification service in UK,How Trump presidency could change Ukraine war,,Closing speeches made in case which North East actor allegedly caused 'brain injury',Body found in search for man who went missing from residential street,Poet laureate’s collaborative anthology to raise cash for Worcestershire Acute Hospitals,,S Club confirm tour to go on after Paul's death,,,The Indian dancers fighting for their daughters' future,,,Top prosecutor refuses to say if search of Nicola Sturgeon's home was 'deliberately delayed',US charges former Apple engineer with attempt to steal self-driving car tech
EU countries adopt law banning products which fuel deforestation,"Strange 7,000-year-old stone road found under sea off Croatia",PM meets with European court chief to call for law change,Why's the Pope peeved about pets? Our quickfire quiz...,,Teenage terror accused of planning race war denies planning to make his own napalm,Faces of evil: The child killer who remained at large for over 30 years,Cash agreed for county service to help those recovering from a stroke,,County could impose Low Traffic Neighbourhoods,,,India considers testing cough syrups before export - media,,,Minister to look at SATs exams after claims pupils had 34 seconds to answer each of the 38 questions,Musk tells Tesla staff he must approve all hiring - memo
Tunisia’s moderate Islamist leader sentenced in absentia to year in prison,Scientists get closer to Covid vaccine that offers lifelong protection,Downing Street denies Nigel Farage's claim Brexit has 'failed',What happened to Jordan Neely?,,Stephen Tompkinson tells court it would be 'career suicide' for him to assault anyone,Why this North East terrace of brick built colliery houses is called Fairy Street,OPERATION SNAP - 151 motorists fined in just one month as West Mercia Police are sent 'bad driving' dash cam videos,,"Boy, 15, dies after being hit by car at crossing",,,"Tesla to meet Indian officials this week, source says",,,PM meets with European court chief to call for law change,Zoom invests in AI startup Anthropic in latest effort to spruce up offerings
Council of Europe summit in Iceland seeks to hold Russia to account for waging war in Ukraine,One million babies could be saved annually with these simple measures,Mortgage rates creep up and 'more increases to come'; pensioners have just days to claim £301 | Cost of living latest,Five times the US wowed Eurovision,,TikTok's Karen's Diner to visit two North East venues this year - what to expect,Alternative rock band's frontman to perform intimate North East gig - here's when,Recognition for University of Worcester trio,,Racing Torque: Alex Jacques on Miami,,,Reliance courts Indian diesel market with cheaper supply,,,London mayoral elections: The runners and riders as Sadiq Khan to stand for third term,"Regulation ‘critical’ to curb risk posed by AI, warns boss of ChatGPT"
Zookeeper found dead in animal enclosure in Slovakia,"
Sexual Double Standard Debunked: Women Are Not Judged More Harshly Than Men ",Tributes to 'heart of gold' dad who died in weekend crash,WATCH: Police mistake goat for man yelling 'help',,Stephen Tompkinson denies punching drunken man in confrontation outside his home,"Explore Roman catacombs, an underground dark matter lab and a military hospital",West Mercia Police mark the coronation of King Charles III,,Listen to BBC Radio Norfolk's The Scrimmage,,,Financials drag Indian shares lower amid earnings rush,,,Iraq catastrophe still looms large over Blair's achievements as ex-PM turns 70,ChatGPT creator testifies before Congress on AI risks and regulation
21 pieces of jewelry worth $129 million were stolen. A court convicts 5 men in museum heist,"
Revolutionizing Protein Design – Engineering a Perfect Molecular Match ",Owner 'devastated' after baby donkey stolen from farm,WATCH: People escape car seconds before train crash,,Here are just some of the sex offenders locked up so far this year,"DNA test advances helped to snare Nikki Allan's killer, in Sunderland, trial was told",University of Worcester student launches police themed children's book,,Relegated Blackpool beat Norwich in final game,,,India plans to challenge EU carbon tax at WTO -sources,,,Downing Street denies Nigel Farage's claim Brexit has 'failed',Sky Mobile hit by massive outage
"Police officer opens fire at bus at girls’ school in Pakistan, killing 1, injuring 5","
The Generosity Divide: How Political Views Shape Altruistic Behavior ",Top prosecutor refuses to say if search of Nicola Sturgeon's home was 'deliberately delayed',The debt ceiling explained - in under 90 seconds,,Comedian to bring stand-up show to three North East venues in UK tour,Sentencing hearing for Nikki Allan's killer may be televised at court in Newcastle,Curtain up for free festival of the arts and well-being at Worcester's Swan Theatre,,Brackley-Harriers & Oxford City-St Albans in finals,,,Indian commercial real estate lull to continue for at least two more years – ANAROCK's Puri,,,Rishi Sunak tries to bring his MPs together at garden party for Conservatives,Watch: OpenAI CEO faces questions from Congress on AI regulation
South Korea and Japan use G-7 to push improvement in ties long marked by animosity,"
Mysterious Author of Early Astronomy Textbooks Unveiled – Researcher Uncovers New Details ",London mayoral elections: The runners and riders as Sadiq Khan to stand for third term,The migrants stuck between two border walls,,Taxi driver jailed for ten years after raping woman who passed out in his cab,Nikki Allan trial: Jury retires to consider its verdict in 30-year-old murder case,Full-fibre network will help Worcester says report,,Goalkeeper McGovern among five leaving Norwich,,,"India monsoon rains to arrive late, hit Kerala on June 4, weather office says",,,Party leaders pay tribute in Senedd as Plaid's Price steps down,Major WhatsApp update enables secret chats 
"Lawsuit filed against Twitter, Saudi Arabia; claims acts of transnational repression committed","
Disinfectant Disaster: Scientists Warn of Health Risks From Popular COVID Cleaners and Hand Sanitizers ",Sunak embraces Zelensky and promises more support on surprise UK trip ,Mayor shows off piano skills with orchestra,,Military expert tells jury how would-be teenage terrorist had explosive recipe,Jury finds former neighbour GUILTY of killing Nikki Allan 30 years ago,‘MMR jabs still available to children’ say County health chiefs,,,,,India's newest infra lender to loan 1 trillion rupees this fiscal -official,,,Protesters disrupt Braverman's immigration speech after Rees-Mogg interrupted on stage,WhatsApp unveils new feature to protect ‘most intimate conversations’
"Cannes Film Festival kicks off with Johnny Depp, ‘Jeanne du Barry’ and plenty to talk about","
A Comprehensive Gun Violence Analysis: Who Has Been Shot and Witnessed Shootings by Race, Sex, and Birth Year ",Sting blasts government’s lack of ‘decency’ over Afghan war hero,Tesla lawyers want court to reconsider Musk tweet deemed 'threat' amid labor dispute,,Taylor Swift fans resurface Denise Welch photo after Matty Healy dating rumours,Nikki Allan murder trial: Jury expected to retire to consider its verdict on Friday,Former Malvern teacher Paul swaps classroom for first-aid courses,,,,,Explainer: Why El Nino is a concern for Indian monsoon rains?,,,Zelenskyy visit: How long can the West pay for Ukraine's war?,WhatsApp offers new password protected feature to hide messages
US condemns arrest of former US consulate employee in Russia,"
The Intriguing Lifestyle of Neanderthals – Tooth Enamel Reveals New Clues ",Prince Andrew ‘refusing to budge’ from Royal Lodge,New York news anchor fired over hot mic attack on co-host,,Mystery North East EuroMillions winner scoops £1 million prize,"Man, 91, left with serious injuries after crash between mobility scooter and car",Talking about some of school’s strategies,,,,,Indian rupee snaps 3-day losing streak on softer dollar,,,"Voter ID laws were an attempt to 'gerrymander', Rees-Mogg suggests",Scientist breaks world record by spending 74 days living underwater 
"Stock market today: Wall Street dips as energy stocks, Home Depot weigh","
Protein Power Unleashed: Spitrobot Makes Time-Resolved Crystallography Accessible ",Dorset streets ‘like a warzone’ after a dozen vehicles set alight,Man on trial for hiding in OnlyFans model’s attic says ‘she liked it’,,Teenager accused of terrorism plot arrested after photographing police station target,Nikki Allan death: Accused Stockton man lacks 'courage' to give evidence in court,Worcester's Simba uses up life in amazing recovery story,,,,,India names former senior tourism official as head of antitrust body,,,Braverman hints at leadership ambitions with unusually personal pitch to Tory right,The Legend of Zelda amiibo is finally back in stock at Amazon
Prince Harry seeks to challenge denial of request to pay for own UK police protection,"
Living Below the Line: New Research Reveals Alarming Pay Gaps in Gig Economy ",Is Nigel Farage preparing another Brexit comeback?,ChatGPT creator testifies before Congress on AI risks and regulation,,'Once in a lifetime opportunity': Medical students to attend Coronation concert,Woman's sexual assault investigation relaunched after winning libel case,Butterfly will make powerful case on world tour visit to Worcester,,,,,CCL Products (India) beats Q4 profit view on higher instant coffee sales,,,'Cronyism and backroom deals': Labour calls for Teesside development probe,"iPhone 15 rumours: Release date, price, specs and more predictions"
"China says ready to ‘smash’ Taiwan self-rule as US prepares major arms package, sends advisers","
Ancient Giants Uncovered: Fossil Site Sheds Light on Arthropod Dominance 470 Million Years Ago ",Sunak’s push for European court reform on Rwanda flights knocked back,Biden vetoes bid by Congress to reinstate tariffs on solar panel imports from SE Asia,,"Stephen Tompkinson 'slapped then punched' drunken man outside house, court told","Man accused of murdering girl, seven, ‘will not give evidence in his defence’","I wasn't with baby during collapse, says Letby",,,,,Granules India's profit boosted by drug ingredient making business,,,Braverman: 'No good reason' UK can't train own HGV drivers and butchers,6 best wifi routers for a speedy connection throughout your home
