world,science,uk,us,teesside,tyneside,sunderland,worcester,bedford,norwich,west_yorkshire,plymouth,india,brazil,turkey,uk_politics,technology
US debt ceiling talks turn to work requirements for benefits programs,"Surfing must get greener, says top UK female champ",Fraudsters sold passports to criminals on the run,North Carolina lawmakers to decide on governor’s veto of 12-week abortion ban,Cop whose pornographic OnlyFans snap surfaced after landing job in force is sacked,"Five arrested after police seize cannabis worth £75,000 and weapons in early morning raids in Walker",Washington teen found guilty of planning act of terrorism at police station,Big night ahead as city council meets to decide new leader and mayor,Biggleswade barn '100% destroyed' after fire causes building to collapse,'Like Blackpool illuminations': Objector could sell house over sign plan,Katie Higton's children leave heartbreaking card at scene of 'double murder' as major police probe continues,Plymouth man jailed for eight and a half years for rape of woman, Proposal to rename Forest Conservation Act reflects govt's mindset of imposing 'one language': Jairam Ramesh ,Mau­soleum of foot­ball leg­end Pele opens to pub­lic in Brazil,Turkey slams elec­tion ob­servers’ ‘lack of trans­paren­cy’ com­ment,Vulnerable paying price for illegal immigration - PM,ChatGPT boss urges US Congress to regulate AI
Kyiv says it shoots down volley of Russian hypersonic missiles,Astronomers detect largest cosmic blast ever seen,Tory donor's link to massive money laundering probe,"Alleged attacker of congressman’s staff had history of mental illness, police say",Teen burglar caught on CCTV and Ring doorbells put behind bars,Mum hits out as TUI refuses refund for flight which diverted back to Newcastle after pilot fell ill,Tragedy as body found in search for missing Sunderland man Jason Cross,Temporary reprieve for man caught with indecent images of children,Map shows every Bedfordshire school rated 'Outstanding' by Ofsted ,Theft of vintage car leaves owner 'devastated' after being taken from driveway,"Woman swiped vase worth £150,000 from Harewood House and kept it on her windowsill",Plymouth MP says Home Office delay to Keyham shooting recommendations 'outrageous' , Lt. Gen. Devendra Sharma takes over as Western Command’s Chief of Staff ,"In Brazil, pris­ons with­out guards of­fer in­mates path to re­cov­ery","As Turkey heads to a pres­i­den­tial elec­tion run-off, what’s next?",Tory donor case reignites debate on access and influence,Facebook and Instagram paid verification starts in UK
"Factbox: What do we know about Kinzhal, Russia's hypersonic missile?",Canadian wildfire smoke reaches US ,Two poultry workers test positive for bird flu,"US driver pulled over for speeding tried to switch places with dog, police say",Decaying pub that cost council £750k cordoned off until inspection to check it's structurally sound,Charity boss on 'concerning' rise in mental health crisis referrals amid cost of living pressures,Nikki Allan's heartbroken mum calls for potential further victims of killer David Boyd to come forward,Drugs and anti-social moped riding near supermarket,Luton man jailed after raping young girl multiple times ,Disabled woman has water flooding into flat for days as workers struggle to stop it,'Dangerous' thug Leon Fenton slashed man's neck with broken beer bottle in 'unprovoked' attack ,Teen appears in court charged with dealing crack cocaine and heroin," Active COVID-19 cases in country dip to 13,037 ",In­dige­nous ad­vo­cates de­cry Carti­er’s use of Ama­zon tribe im­ages,"In Turkey’s elec­tions, na­tion­al­ism is the real win­ner",Tory donor's link to massive money laundering probe,Twitter criticised for blocking tweets in Turkey
"U.S. charges Apple ex-employee for trying to steal technology, fleeing to China",Welsh space firm devises 'shuttlecock' heatshield,Kate ‘never expected to be royal but fell in love’,"New Mexico shooter roamed area with at least three guns, police say",Stockton baby born with four rare heart defects undergoes life-saving surgery at six-months-old,Newcastle pub launches open-air cinema showing cult classic films for free ,Five North East beaches awarded Blue Flag status in time for summer,West Midlands Railway urge passengers to check train times ahead of major change,Central Bedfordshire: Ousted council leader points blame at Westminster for Tory collapse,House on Norwich’s ‘most famous road’ goes up for sale,"Police reveal Katie Higton and Steven Harnett suffered 'multiple injuries' with 'bladed weapon' as man, 34, held on suspicion of double murder",Plymouth supermarket evacuated as firefighters tackle electrical blaze," With militants changing tack, Rajouri-Poonch sector an uphill task for security agencies ",Brazil­ian rock icon Rita Lee dies aged 75,Dis­be­lief in Di­yarbakir as Turkey heads for pres­i­den­tial runoff,"More fruit pickers welcome in UK, says PM",Fines proposed over sexist online abuse
Biden maintains edge over Trump in 2024 US election -Reuters/Ipsos poll,Wind is main source of electricity for first time,Bank economist sorry for 'you're poorer' remark,Missouri high-schooler suspended for recording teacher using racial slur,Norton grill restaurant with roof-top terrace goes the market for £1m months after launch,Five men arrested after 27-hour stand-off on Newcastle factory roof,"""He's a monster"": Nikki Allan's mum Sharon Henderson still tortured after murder conviction",Police take back home by force and search for knives in 'day of action',Emergency services rush to Woburn Center Parcs as air ambulance lands nearby,Images reveal how 55 new homes could take shape in city centre,Batley campaigners to protest leisure centre closure this weekend,Barbican's new Armado Lounge cafe and bar opening next week,"
SC transfers endosulfan case to Kerala HC for monitoring government’s medical and palliative measures for victims ","UK to con­tribute to Brazil’s Ama­zon de­fence fund, PM Sunak says",Are killer ro­bots the fu­ture of war?,Sunak rejects Tory MP's claim about family values,Microsoft's $69bn Activision deal approved by EU
World Bank suspends $1 bln worth of project funding in Congo,Which European nations are winning the heat pump race?,Rapper Slowthai appears in court after rape charge,"Are you a doctor who hates treating gay people? Come to Florida, where Ron DeSantis has legalised bigotry",Ben Houchen calls for Teesworks investigation after Labour demands inquiry,CCTV image released as police investigate series of attempted thefts in Newcastle,Sunderland boss Tony Mowbray on his penalty policy as the Black Cats look to book Wembley trip,Latest update on elderly woman stabbed multiple times in Kleve Walk,Yarl's Wood Immigration Removal Centre: Police release image of the final Yarl's Wood escapee yet to be found,Dealer admits Norwich drug dealing offences,Heartbroken family reveal two children were inside the house when 'bubbly' mum Katie Higton was killed,Plymouth City Council honours ex-lord mayor Brian Vincent after his death,"
PM Modi shattered dreams of 18 crore youth: Congress on 'Rozgar Melas' ",A Brazil­ian ‘Min­istry of Truth’ is in the mak­ing,Is Er­do­gan at risk of los­ing his job?,Police to investigate MP accused of sexual assault,Should social media face-altering filters be regulated?
"Ukrainian army revamps commercial drones to attack Russian tanks, trenches",Green energy projects worth billions stuck on hold,"Privacy breaches covered up, Prince Harry case told","Vice is going bankrupt, BuzzFeed News is dead. What does it mean?",Arrest made after man allegedly carrying gun sees police swarm Redcar with helicopter circling above,Greggs aiming to maintain prices despite challenges of inflation,'Knives are not trophies' - Mum of murdered Connor Brown urges people to stop carrying weapons,Man found in icy lake was happy with his life - inquest hears,Bedfordshire households urged to 'check for credentials' after fears of a rise in rogue traders,Appeal to find family of 60-year-old Norwich woman,Serious crash closes A6177 in Bradford in both directions - live updates,Plympton Lidl evacuated as firefighters called to store - updates,"
Land-for-jobs case: CBI searches premises linked to RJD legislators ","Brazil­ian po­lice raid ex-Pres­i­dent Bol­sonaro’s home, seize phone",Why na­tion­al­ist Ogan could be ‘king­mak­er’ in Turkey’s run-off,Fines proposed over sexist online abuse,Elon Musk names Linda Yaccarino new Twitter boss
"Factbox: Wife of Pakistan's Khan, charged with graft, is known for spirituality",Father challenges BP at meeting after son's death,Mother-of-four stabbed to death named by police,"Is Martha Stewart’s Sports Illustrated cover a diversity breakthrough? No, it’s just window dressing",Man seen holding car bonnet on CCTV moments after Boro fan's Corsa broken into during match,Inquest held into death of 'beautiful girl' who was one of youngest people to receive a heart transplant,Brazen Sunderland scammers made £2m by tricking people into buying European health cards,Worcestershire bowler delighted to register first five-for in first-class cricket,"Touching story behind Bedfordshire father and son's plan to cycle 1,000 miles from Ampthill to Bilbao ",New fine dining Indian restaurant opens in village,I've had death threats and horrific disgusting abuse just for helping feed the needy,Plymouth police release CCTV image after woman 'punched in the face', MEA rejects U.S. State Department report citing deteriorating religious freedom in India ,Brazil’s ‘fake news’ bill sparks out­cry from tech gi­ants,Er­do­gan de­fies ‘politi­cised’ opin­ion polls in Turk­ish elec­tion,Teachers and nurses dragged into higher taxes,Hacker market still active after police 'takedown'
Canada's Alberta braces for wildfires to spread as winds shift,How to talk to your parents about climate change,Police to investigate MP accused of sexual assault,No one has accepted real responsibility for the East Palestine disaster,MP says police commissioner should 'put big boy pants on' after election complaint triggers force probe,Palestine activists remain in rooftop stand-off on Scotswood Road after 12 hours,Tony Mowbray backs Sunderland to keep their scoring run going and pile play-off pressure on Luton,Shop staff 'threatened with screwdrivers by shoplifters',Section of Ampthill road closed after 'sinkhole' appears ,Norwich 'feel-good' jewellery brand gears up for expansion across country,New homes which encroach onto Huddersfield green belt land approved despite dismay of locals,Met Office explains why a heatwave isn't on the way, Supreme Court rejects petitions seeking review of EWS quota judgment ,Brazil: Il­le­gal gold min­ers fa­tal­ly shot in In­dige­nous ter­ri­to­ry,Turkey’s pres­i­den­tial elec­tion goes to run-off: Elec­tion coun­cil,Train fruit pickers to cut migration - Braverman,Fans react to Zelda sequel after six-year wait
Ukraine Supreme Court chief dismissed after being detained in bribery case,Is India ready to deal with deadly heatwaves?,"School-absence fines make problem worse, MPs told",Republicans aren’t fixing the migrant border plight. In fact they’re making it worse,'Armed raids' in Middlesbrough part of ongoing investigation as huge convoy of police vehicles seen,'Essential' expansion of Newcastle special school planned to cope with rising pressure for places,Police helicopter search over Sunderland after reports of disturbance involving three men by roadside,How club grew for city and county,Bedfordshire roadworks: Roadworks and closures affecting key roads and towns this week,A47 closed in both directions amid police incident,Huddersfield man arrested after man and woman found dead in house,Plymouth teen arrested for suspected drugs after being stopped in West Park, Leh airport closed after IAF plane stuck on runway ,Brazil’s Lula re­sumes cre­ation of In­dige­nous reser­va­tions,What’s a run-off? All to know about Turkey elec­tion re­sults,Zelensky meets PM as more Ukraine weapons pledged,Why Pakistan shut down the internet
Making the four-day week work for Britain,Five things we've learned from UN climate report,Greggs wins right to sell late-night sausage rolls,The EU should start planning now for Russia after Putin,Teesside beaches given clean seal of approval - but none have Blue Flags after Saltburn missed out,"Police find cannabis farm with 250 plants in Newcastle home worth more than £200,000",Attack is the best form of defence for Sunderland says Tony Mowbray ahead of Luton play-off clash,"New disabled toilet costing £80,000 could come to Worcester",M1 traffic: 'Police-led' incident completely closes motorway causing huge delays between junction 14 and 15,Shock for teen rower as 'disgusting' sewage floats along River Yare,Huddersfield bar Maverick's 'female staff' job ad sparks sexism row,Popular Saltash estate agent Mike Wainwright dies on holiday aged just 40," PM Modi to visit Japan, Papua New Guinea and Australia from May 19-24 ",Want to fix the cli­mate? End debt traps,Er­do­gan’s AK Par­ty wins par­lia­men­tary ma­jor­i­ty: State me­dia,"Voter ID backfired on Tories, says Rees-Mogg",UK tech tycoon extradited to US in fraud case
"With eye on Ukraine, top Chinese general calls for unconventional warfare capabilities",UN releases 'survival guide' to avert climate disaster,Oxford university drops Sackler name from sites,Bird flu could become the next human pandemic – and politicians aren’t paying attention,The exact date this month you should receive £301 DWP cost of living payment by,Newcastle Clean Air Zone July date confirmed for start of £12.50 daily tolls for vans,Join ChronicleLive's WhatsApp community for breaking news and top stories,Police checking through hedges to find hidden knives and weapons,Luton crime: One crime committed for every three people living in Bedfordshire’s crime hotspot,Hip-hop festival with BBQ and free graffiti workshop coming to Norwich,Huddersfield double murder investigation as man and woman found dead in Dalton house,Plymouth City Council slammed by ICO over failing to respond to information requests," Chhattisgarh liquor scam | Do not create an “atmosphere of fear”, Supreme Court tells ED ",Ex-Brazil Pres­i­dent Bol­sonaro ap­pears be­fore po­lice in riot probe,Turkey’s elec­tion like­ly head­ing to run-off; Er­do­gan has the edge,Brexit rules bill defeats for ministers in Lords,UK further restricts Microsoft and Activision merge
"US on track for June 1 default without debt ceiling hike, Treasury says ",Exhibition highlights dangers of space junk,Living next to one of football's most unusual away ends,White House timidity on the debt ceiling is infuriating. What is it afraid of?,Last orders for couple that 'gave Guisborough pub its soul back' after shock leaving announcement,Ex-Archbishop steps back from ministry in Newcastle diocese over handling of abuse case,Warning as families face bills to replace broken smart meter displays,Roadworks chaos as it becomes 'impossible' for residents who are blocked,Man arrested after 'tragic' crash that left one dead in Dunton,'Sheds can literally save lives' - group supporting men up for national award,Bradford police station 'gunman' facing hospital order,Plymouth's unclaimed estates and the surnames that could unlock huge cash sums, EU Foreign Minister says Europe should stop entry of Indian products made from Russian oil ,"Pho­tos: In Brazil, the In­dige­nous Games cel­e­brate cul­ture, sport",Turkey elec­tion re­sults up­dates: Er­do­gan-Kil­ic­daroglu in run-off,PM announces extending seasonal visas for fruit pickers,Tech Life: a Facebook moderator's story
"Prince Harry should not be allowed to pay for police protection, court told",UK 'knitted satellite' will see Earth day or night,UVF gives 1974 murder account to victim's family,Philadelphia 76ers fire Doc Rivers after latest playoff exit,Diggers move in on 'eyesore' Phoenix House as demolition of 1960s office block finally gets underway,Paranoid Byker neighbour accused woman of 'spying' and dished out terrifying death threats,DWP clarifies PIP assessment 20-metre rule and when informal observations start,Fire breaks out near storage container filled with machinery and fuel,Video shows fire engulfing a car in Bedford after incident shut town centre road,'We're struggling' - Norwich business receives outpouring of support after plea,£1m Kirklees National Lottery remains unclaimed as search for mystery millionaire goes on,Plymouth councillor defends Jesters ahead of crucial licence review," With militants changing tack, Rajouri-Poonch sector an uphill challengefor security agencies ","Por­tu­gal should take ‘re­spon­si­bil­i­ty’ for slav­ery, pres­i­dent says",Turkey par­ties squab­ble as cru­cial vote count see­saws,Stage invasions disrupt Rees-Mogg and Braverman speeches,"Watch UK alert go off (again, or if you missed it)"
Chinese warships return to West Pacific for live-fire drills,Europe's new weather satellite takes first photos,Chris Mason: Vocal Tory right give PM a headache,Arsenal’s Folarin Balogun opts to play for United States instead of England,MP adds voice to over 650 objections to 'vague and disjointed' plan for 700 new homes,All the roadworks and road closures happening in the North East this week,Vote for your favourite North East Sunday lunch spot in our interactive poll,Thieves and public order: Who has appeared at Worcester magistrates,Luton's first 'pocket park' to officially open with festival this month,Norwich court told man accused of raft of sex offences has died,Award-winning Yorkshire restaurant shuts due to cost of living crisis and rising energy bills,Heartbreak as 10 people die on our roads in tragic few weeks, Dengue vaccine: India moves closer to getting its first indigenous vaccine ,"
								Cultural center on wheels brings the arts closer to working-class Brazilians","
								Erdogan's strong showing signals ""business as usual"" for Mideast",Shapps: Government is committed to its pledges,Tech Life: Is AI racing ahead too fast?
Biden administration announces $11 billion for rural clean energy projects,Will humans ever be able to give birth in space?,"I don't have ADHD, but three private clinics say I do",Former UFC champion Francis Ngannou signs with PFL after contentious split,Schools minister promises action over 'too difficult' SATs exam that left children 'in tears',Meet the 46 cats and dogs at Newcastle Cat and Dog shelter looking for their forever home this summer,Aldi shoppers say new £2.99 scented candles have 'the most beautiful smell',Drink driver came off road and went through hedge,84-year-old Luton Town fan attends first match in over a decade,City mum wins gold at her first bodybuilding competition,Huddersfield barman 'attacked by chair-throwing yob' who taunted 'how are you going to stop me' ,Met Office verdict on African plume heatwave reported to bring 35C heat to UK, NHRC notice to States on increase in Child Sexual Abuse Material on social media ,"
								Thales, Gol ink deal to move maintenance services to Brazil","
								Turkish pollsters failed to predict outcome, in shock for markets and voters",Labour: No final policy on giving votes to EU citizens,Watch: BBC News' interview with Elon Musk in full
Biden administration grants Mountain Valley Pipeline permit,How the ISS will end its life in orbit,New sheep breed gives high quality wool and meat,Aaron Judge denies looking for signal before hitting home run against Blue Jays,Tory MPs' comments resurface over controversial development board after appointment uncertainty,Former NUFC player has banning order lifted after court finds pre-match disorder was not football related,"McDonald's set to axe five menu items this week, as brand new burger lands",Non-league allocations revealed; City join Raiders and Pershore in Hellenic League,Bird flu confirmed after more than 100 birds found dead in Bedford park,Councils hope to make 'huge savings' after FINALLY moving to new offices this month,"Tragedy as man, 20, dies after crashing car into parked horsebox near Halifax",Firestone Bay enjoys first day of bathing water status following MP's campaign  , PM Modi interacts with tribal leaders from Arunachal Pradesh ,"
								Brazil confirms first ever avian flu cases in wild birds","
								Turkey faces election runoff, Erdogan seen with momentum",Watch minister get angry telling-off for media leaks,Tech Life: Do we share too much about kids online?
DeSantis defunds diversity programs at Florida public colleges,Pompeii dig finds skeletal remains dating back to Vesuvius earthquake,Stage invasions disrupt Rees-Mogg and Braverman speeches,OpenAI CEO calls for laws to mitigate ‘risks of increasingly powerful’ AI,Last chance to give North East charities a reward,Children's Cancer Run in Newcastle sees huge turnout as it celebrates its 40-year anniversary,Seven summer dangers for dog owners to watch out for from grass seeds to snail pellets,RGS Worcester powerlifting pair qualify for National Championships,Met Office weather: Thunderstorms on their way for third straight day as Met Office issues yellow warning,Police hope witness will come forward after vicious assault of  12-year-old,Yorkshire school's tribute to 'funny and friendly' pupil killed in horror Halifax crash,Tudor Evans names his Plymouth City Council Labour cabinet," Centre to recruit private sector specialists as joint secretaries, directors and deputy secretaries ","
								Strong loan book powers Banco do Brasil to quarterly profit surge","
								For Turkey runoff, potential kingmaker draws red line at concessions to Kurds",Chris Mason: Vocal Tory right give Sunak a headache,How computer games encourage kids to spend cash
"Ukraine reports gains around Bakhmut, battles continue",Potential antidote found for toxin in world’s most poisonous mushroom,Watch: Best bits from the Baftas... in 80 seconds,Roger Ailes’s widow says Murdochs have ‘wreaked havoc’ on Fox News,Council blocks release of report it commissioned from private firm into former leader Mary Lanigan's behaviour,Newcastle former stroke ward worker gives talks on how to spot warning signs,The Coronation of King Charles III told in photographs,White van recovered 'minutes after it was stolen',Bedfordshire dads to walk 96-miles in 48 hours for Great Ormond Street Hospital after their children's GOSH care,Man on trial accused of Norwich stabbing 'taken ill',Huddersfield George Hotel update on major extension as contractors appointed ,"Young Plymouth woman, 22, found dead in OYO hotel"," Indian medical devices sector to emerge as global leader in manufacturing, innovation in 25 years: Mandaviya ","
								Buffett-backed Nubank reports record revenue on steady user growth","
								Turkey's election board showed lack of transparency - OSCE observers",Power struggle over who should keep an eye on police,Which European nations are winning the heat pump race?
"Russia, Ukraine to receive African mission on potential peace plan, Pretoria says",Plans for UK ‘genomics transformation’ aim to act on lessons of Covid,Eurovision: The final party in 90 seconds,Silicon Valley Bank’s former CEO tells Senate he is ‘truly sorry’ for collapse,Judge orders Belgian Malinois which bit delivery driver on legs and bum is put to sleep,Sleeping man found with knife with 'AK-47' written on blade inside toilets at Newcastle Airport,Supermarkets and shops that will stay closed on Boxing Day 2021 - the list so far,Watch air ambulance spotted flying low over Worcester,Railway bridge repairs to close key road near Bedford for more than a month,Dozens of unclaimed estates in Norfolk - are you sitting on a fortune?,"Live police search for missing schoolboy Deacon Pullen, 15, last seen more than 3 days ago",Firm that ran The Social cocktail bars in Plymouth and Liskeard goes bust owing £345k," SC Collegium recommends AP Chief Justice, senior advocate Vishwanathan as apex court judges ","
								Deforestation in Brazil's Amazon falls 68% in April, first major drop under Lula","
								Analysis-Turkey's Erdogan cruising, challenger scrambling toward runoff election",Is the UK too late to beat the US in the global trade war?,Can a wind turbine handle hurricane speed winds?
Ukraine-Russia war: Wagner chief poses with 'body of US fighter' killed in Bakhmut,Is it the beginning of the end for scientific publishing?,All the times Eurovision's presenters stole the show,Progressive organization Justice Democrats adopts four-day work week,"Thug who 'chased, cornered and stabbed rival' outside primary school jailed alongside girlfriend",Teens from Gateshead's Springwell Estate campaign for street lights following murder of Tomasz Oleszak,How can you tell the difference between a 'super cold' and Covid-19?,Grieving family hope to get answers six years after tragic 'preventable' death,The public's chance to comment on plans to expand Luton Airport - including construction of a second terminal,Dozens of trains cancelled due to week-long 'action short of strike',Police statement on huge cordon in Huddersfield street as two people found badly injured in house,Holidaymaker dies in car and motorbike crash near Modbury, Gadkari gets another threat call at official residence in Delhi ,"
								U.S. Congressman George Santos agrees to settle lawsuit in Brazil","
								Turkish opposition supporters voice dismay over presidential vote",Wooing expat voters with post-Brexit woes in Spain,Why teaching robots to blink is hard but important
