world,science,uk,us,teesside,tyneside,sunderland,worcester,bedford,norwich,west_yorkshire,plymouth,india,brazil,turkey,uk_politics,technology
Martha Stewart appears on cover of swimsuit edition of Sports Illustrated at 81,"Talking to babies may help shape brain structure, research finds",Mae Muller gets surprise call from Ringo Starr!,What is the US debt ceiling and what will happen if it is not raised?,"Gambling addict preyed on innocent victims and pocketed £45,000 in tax fraud before HMRC bust",Great Market Caper set for June return with new name and a new home at Baltic,Durham Cathedral visitor numbers rocket after Museum of the Moon lands,Family friendly mini-festival has lots on offer for little ones,Bedfordshire Police defends social media policy after concerns it makes Bedfordshire look 'overwhelmed' by 'ghastly crimes',Uncertainty continues over city centre supermarket deal,'Loving' mum and dad 'with heart of gold' found dead in Huddersfield house as police launch murder investigation - latest,Plymouth Half Marathon results listed in full,"PM Modi to attend G7, Quad summits","
								JBS shares slump as Q1 shows global difficulties","
								Erdogan's milestones as Turkey faces May 28 runoff vote",Chris Mason: EU law pledge collides with reality,The people turning time into a currency
Influencer launches AI app that makes her your virtual girlfriend for 80p a minute,The biggest ever space explosion has occurred – what do you mean you don’t care?,Serving Met Police officer charged with rape,The UK has a PR plan masquerading as an industrial strategy,A19 near Wolviston remains closed as tanker blocks northbound carriageway,Council tenant satisfaction plummets by half to 44% in Gateshead,How to get SunderlandLive's top stories sent straight to your inbox with our newsletters,Worcester man made to pay hundreds after dodging £3.70 train fare,Met Office weather: Seven-hour yellow thunderstorm warning put in place as second bout of storms on their way,Man found dead inside NR2 home,Life in the 'proud' Huddersfield village where locals are frustrated by yobs and 'council inaction',Teenage girl who died in crash with Plymouth driver is named,Visitors can now enter Rashtrapati Bhavan 6 days a week. Here’s all you need to know,"
								Spanish PM will ask Biden to listen to China, Brazil on Ukraine","
								In Turkish election, some voters return to quake zone to cast ballots",Ben Jennings on Suella Braverman’s dreams of being in No 10 — cartoon,Universal flu jab moves one step closer - paving way for end to yearly vaccinations
Six killed and at least 30 missing in New Zealand hostel fire,"UK’s most literal rock documentary, A Year in a Field, up for film prize",MasterChef contestant on indecent images charges,Autonomy founder Mike Lynch extradited to US after losing appeal,Cleveland Police officer admits he was 'childish' after telling teen 'I would have sparked you clean out',"Mould, damp and condensation reported in more than 1,000 of Gateshead's council houses",Appeal to find missing Sunderland man as police become 'increasingly concerned' for welfare,Celebrate historic Oak Apple day at city museum,Who is Tom Wootton? Bedford's first new mayor in more than a decade,Pub to reopen following refurb with new owners and added steak restaurant,Huddersfield man given 6% chance of survival after collapse during Huddersfield park run,Royal Navy sailor found dead after night out in Stockholm as four arrested,"SC sets aside Madras HC order, allows probe to continue against TN minister","
								Brazil's Petrobras posts 14% profit dip, but beats expectations","
								Turkey elections 2023: what you need to know",The Guardian view on the cost of living crisis: Labour needs creative solutions,Senator's chilling warning after AI imitates him at Congress hearing
Erdogan eyes third term after first-round win,"Overhaul UK fertility law to keep up with advancements, expert says",Police waited two weeks for SNP search warrant,‘The law is finally catching up’: the union contract fight at Starbucks,Man armed with hoover hose walks free from court after town centre fracas,'Intoxicated' Newcastle burglar was arrested after running out of petrol in stolen car,Luton will play 'like our lives depend on it' vs Sunderland as Rob Edwards urges play-off response,Mission to tackle 'devastating' knife crime in Worcester,Free festival with classic cars and dragon boat racing to take place in Bedford next month,City shoe shop closed 'until further notice' due to flooding,'Heart of gold' dad found dead at Dalton house named as Steven Harnett,Toddler dies after being hit by tractor on farm,"Chhattisgarh liquor scam: Don’t create atmosphere of fear, SC tells ED","In 10 Years of Permission, Same-Sex Marriages Quadruple in Brazil",Health tourism warning after mother-of-three’s liposuction death in Turkey,Asylum seekers to lose basic housing protections in move to cut hotel use ,Facebook and Instagram owner launches paid verification service in UK
Austrian train plays Hitler speech over loudspeaker,Climate crisis deniers target scientists for vicious abuse on Musk’s Twitter,Nightclub fire victim's father haunted by tragedy,US inflation beat forecasts in April but remained high at 4.9%,An independent audit is now the only way forward for Teesworks,The top ten Sunday lunch spots across the North East according to our readers,All the roadworks and road closures happening in the North East this week,How one city school helped its pupils cope with 'tricky' SATs papers,Three of Bedfordshire's best walks that end in a pub,Huge event with 200 steam engines and vintage vehicles returning to Norfolk,Holly Willoughby issues lengthy statement to fans after Phillip Schofield This Morning 'feud',Plymouth's Barcode is getting indoor 'competitive socialising' leisure attraction Spinners,"Dowry torture, domestic violence allegations against 2 former Odisha ministers",7 out of 10 Women in Brazil Are Mothers; Half of them Solo,What do Turkey’s election results mean and who will win the runoff?,No 10 food summit ‘no more than a PR stunt’ and failed to tackle key issues,First cases of treatment-resistant ringworm found in patients in US
"FBI ‘should never have investigated Trump’s links to Russia in 2016 election’, report finds","Ministers not doing enough to control AI, says UK professor",Man given nationwide sexual comments ban,CCTV video shows moments leading up to Banko Brown shooting – video,Cross-party calls for a review into Teesworks finances - welcomed by Mayor,Paedophile jailed for life for horrific sex attacks on three children,Chronicle Live readers vote for their top ten Sunday lunch spots across the North East,Halloween mask moped gang threaten to stab off-duty paramedic,,'I'll never forget' - Memories of when The Beatles played Norwich 60 years on,Tragedy as mum found dead in Dalton home named as nurse Katie Louise Higton,Frustration grows at delayed response on shootings,Adani helps airlift mountaineer Anurag Maloo from Kathmandu to AIIMS,Bolsonarists Convicted of Bombing Truck Near Airport in Brasilia,"A rare, endangered seal named Yulia basks on Tel Aviv beach",Why are terms linked to antisemitism being used at UK conservatism event?,Watch live: OpenAI boss addresses US Senate
The amateur botanist risking his life to save Ukraine's rare apples and pears,Simon Schama on the broken relationship between humans and nature: ‘The joke’s on us. Things are amiss’,UK government rejects criticism that Brexit has failed,Scenes from the US-Mexico border as Title 42 ends: in pictures ,Man arrested and 150 cannabis plants seized after police stop van on A19,Vote for your favourite North East curry house in our interactive poll,Aji Alese could be involved in Sunderland's play-off game at Luton but doubts persist over key duo,Concerns for woman's welfare,,REVEALED: Plans for housing development at historic city centre site,"Thousands of dead crabs, mussels and clams wash up on Yorkshire beach as 'die-off' continues",Blue Flag award for 23 South West beaches in 2023,Ready to contest against Scindia in Guna if party asks: Digvijaya Singh,Couple Attacked in Carrefour Group Supermarket in Brazil Says They Tried to Steal Milk to Feed their Daughter,Erdogan gains upper hand as presidential race to be settled by run-off,Michael Gove leaves everyone feeling they’ve been NatConned ,WhatsApp announces new locked chats for 'intimate conversations'
On the front line when Ukraine did the unthinkable in Bakhmut after months of retreat,‘Sometimes I don’t recognise my own family’: life with face blindness,"Prince Harry should not be allowed to pay for police protection, court told",Title 42: confusion at the US-Mexico border as migrant restrictions lift – video,"How £750,000 to help people in North East  with gambling issues could be used",Popular Gateshead pub announces sudden closure,"Primark shoppers can snap up £7 retro bag inspired by £3,000 Chanel version",Moment man accused of Alfie Steel's murder arrested at train station shown to jury,,"Woman raped by two men she met on Norwich night out, court hears",Moment police swoop on car carrying 3D printer machine guns made by arms dealers in 'UK first' ,Motorcyclist suffers life-threatening injuries in crash,"8 in 10 urban Indians believe in existence of God, says Ipsos survey",Telegram Brazil Deletes Message about Fake News Bill after Justice's Order,"Back in the Arab League after 12 years, Syria urges group to invest in war-torn country",UK watchdog denies it blocked Microsoft deal on orders of US regulator,How a British computer scientist became the 'Godfather of AI'
Putin's fighting power is exhausted in Ukraine – here's why | Defence in Depth,Is Covid really over? WHO’s announcement sounds more like surrender than victory,Making the four-day week work for Britain,Biden administration announces $11 billion for rural clean energy projects,Teenager denies murder of 'much-loved' father-of-one,Gateshead owners of Durham city nightclub fined over licensing breaches,Matalan shoppers praise 'stunning' £40 outfit dubbed 'the suit of the summer','I hid behind my child' dramatic transformation as woman loses seven stones,,Sprowston mum launches new bao bun business,"Aldi, Asda, Morrisons, Sainsbury’s, Tesco and more see food basics prices DOUBLE in price over a year",End of life companion scheme calls for volunteers,ASI should survey entire Gyanvapi mosque: Application in Varanasi court,"Brazilian Politician David Miranda, Journalist Glenn Greenwald's Husband, Dies",AP News Digest 3:35 am,Why Labour must heed the clamour for change,What was the reaction to the King and coronation online?
Volodymyr Zelensky ‘wanted Ukraine to occupy Russian villages’,Covid-19 dropped as cause of death in the US in 2022,"UK jobless rate rises, potentially easing BoE inflation worries",Writers’ strike injects uncertainty into upfront ad-selling ritual,Couple jailed after man stabbed in the face during 'revenge' attack near school,Police probing video of violent assault at Birtley gym,Queen Camilla's Coronation outfit included nod to beloved rescue dogs as viewers spot sweet detail,"Woman, 38, who shouted and swore in city street appeared before magistrates",,"Garden party near city to include top tribute acts, inflatables and street food",Marathon one of the best days of my life - Burrow,Surfing family of four in medals sweep,"Race for Karnataka CM hots up as Kharge holds one-on-one meet with Siddaramaiah, D K Shivakumar ",Telegram Brazil Distorts Fake News Bill and Talks about Censorship,"As Erdogan's votes dip, Turkey seen headed to a runoff presidential race",Retrain MPs to pick fruit and drive lorries,Microsoft-Activision Blizzard £55bn merger approved by EU - despite UK rejection
Alec Baldwin praised ‘sweet and generous’ Trump years before mocking SNL portrayal,Bird flu could become the next human pandemic – and politicians aren’t paying attention,Salman Rushdie warns of threat to freedom of expression in West,Kentucky Republicans to choose challenger to Democratic Governor Beshear,Police concerned for man's safety after he was last spotted near rocks by sea,Warning over £63m fund as decision nears on at-risk Gateshead leisure centres,The financial help you can get if you have a disabled child including grants and cash payments,'Here to stay' cafe owner assures customers as business spotted for sale online,,'Norwich is happening place': Dad of three to open new city centre café,Mother-of-four stabbed to death named by police,Six more areas in Devon chosen for 20mph schemes,Clash over ‘The Kerala Story’: Jammu medical college rusticates 10 students from hostel,Defendants in the Bruno and Dom Case Give Testimony to Federal Court,Erdogan says he can still win Turkey election despite run-off prospect,Lawyers welcome naming of Tory donor in money-laundering case,Musk tells Macron he had to 'sleep in the car' before meeting French president
"UFO ‘sightings’ most likely tech made by human adversaries, Pentagon told",The apocalypse isn’t coming. We must resist cynicism and fear about AI,"New Vodafone boss takes aim at costs with 11,000 global job cuts",North Carolina lawmakers to vote on overriding veto of 12-week abortion ban,Teenager assaulted and left with injuries as police launch search for two suspects,Chronicle Live readers vote for their top ten Sunday lunch spots across the North East,New technology put in place to stop scammers preying on elderly people in Northumberland,Retro gaming bar takes next step in move to bigger venue,,Watchdogs reprimand council over personal information requests,Wakefield rapist jailed for eight years,"Surfing must get greener, says top UK female champ","SC collegium recommends AP CJ Mishra, senior advocate KV Viswanathan for elevation as apex court judges",Woman's Body Found in Mining Area in Yanomami Territory,Erdogan and Kilicdaroglu cast votes in Turkish elections,Michael Gove says Tories will not win election with culture wars,Ancient meteorites 'reveal secrets of Jupiter's formation'
Friends star Matthew Perry says 'mean' comments about Keanu Reeves will be removed from memoir,"A moment’s silence, please, for the death of Mark Zuckerberg’s metaverse",Chinese embassy criticises former UK PM Truss's visit to Taiwan,US Senate hearing on China to draw rare Biden cabinet trio,Titanic story brought to life in North East exhibition of artefacts from ship,Lockdown Lives: Gateshead exhibition showcases art making sense of the Covid-19 pandemic,Signs of asthma in children as number of youngsters ending up in hospital doubles,Work progressing on city's newest bridge,,New city bar to host popular street food vendor,Pair jailed for 3D-printed sub-machine gun plot,Navy sailor on military exercise dead in Stockholm,"76% of regional parties’ income came from unknown sources, of which 93% was from electoral bonds: ADR",Right Wing Has A Boom of Verified Profiles and More Exposure on Twitter,AP News Digest 6 a.m.,Home Office to fast-track thousands of Iraqi and Iranian asylum claims,Newspaper apologises and takes down 'hoax' AI-generated article
Trump-backing pillow entrepreneur who set up ‘prove me wrong’ contest must pay $5m to man who did,Could an ‘emotional support’ chatbot help me de-stress? Only one way to find out,UK and EU agree to strengthen cooperation on migration,US debt ceiling talks turn to work requirements for benefits programs,Shoplifter warned he faces prison if he commits any offence for next 12 months,"All of the North East pubs, restaurants and takeaways with zero food hygiene ratings",Remembrance Sunday Parade in Sunderland city centre,Worcester firm 'stands test of time' to mark 50 years in business,,Road reopens after crash involving car and bicycle,'Older man' fends off gang with walking stick,Campervan driver dies in three-vehicle crash,SC to hear in July plea of Gujarat judicial officers whose promotions stayed by it,Discord Turns into Lawless Land with Groups Encouraging Sex Crimes and Violence,"Syria's main insurgent group seeks to move away from al-Qaida past, get off Western terrorism lists",Prince Harry begins second legal case against Home Office over personal security,"Avoid using sweeteners for weight control, World Health Organisation says"
"I was scared of dying, says woman in Tariq Ramadan rape trial",Will psychedelic drugs transform mental health treatment? – podcast,UK detects bird flu in two poultry workers - health agency,"Ahead of 2024 bid, DeSantis challenges Trump on abortion limits",Mayor seeks to ease concerns after 'false' claims Teesworks site sold for £100,Newcastle United fans issued Metro warning ahead of Manchester United clash,"The North East serial thieves caught stealing booze, chocolate, charity boxes and tins of tuna",Emergency services spotted in city centre,,Mental health nurse was 'frightened for her life' after knife threat,Thousands of voters without ID barred from polls,Child dies after being hit by tractor,CBI books freelance journalist over espionage charges,Uprise of Violence on Yanomami Land Pressures Ministry of Defense,Campaigning in Turkey's pivotal elections nearing end,Speaker at UK conservatism event echoes far right in attack on ‘globalists’,Dyson claims PM's pledge to turn UK into science superpower is hot air
Brigitte Macron condemns ‘cowardice’ of protesters who beat up her great-nephew,How AI is making non-invasive mind reading a reality – podcast,Bank of England's Pill says BoE must guard against inflation sticking above 2%,U.S. condemns reported arrest of former U.S. mission employee in Russia,Public health initiative on chronic pain management arrives in Darlington during tour,"North East Today: June Tron's 'agony' over MI5 failings, a mum finally gets her money back and Eddie Howe is in search of goals",'I feel numb and shocked': The family of Nikki Allan speak after monumental guilty verdict which took 31 years,U-turn on rent price hike leaves pensioners 'chuffed',,1700 litres of diesel stolen from dig site near Norwich,Child sex abuse teacher had paedophile manual,Sea water testing starts for bathers,"Onset of monsoon over Kerala to be delayed, likely to be on June 4: IMD",Man Fired after 1964 Coup in Brazil Is Rehired by The Bank 59 Years Later,Erdogan risks losing power as high-stakes Turkey election reaches end,The centre left is on the up around the world. Here’s what Keir Starmer can learn from it,Who is the new Twitter chief executive Linda Yaccarino?
Iran human rights role ‘like granting Bin Laden a Nobel Peace Prize’,Can cities help us fight climate change? – podcast,"Britons face biggest tax rise since 1979, think tank says",White House wants to improve access to opioid overdose reversal medication,Doggy recruits to care'bark' team bring animal therapy to residents,Hughie Gallacher - the Newcastle United all-time great who embraced triumph and tragedy,Years of torment and pain released in a moment as Nikki Allan's family celebrate verdict in courtroom eruption,Train fare dodger landed with £400 bill over £3.70 ticket,,Child scorcher! Mum scoulds work to improve unloved park with 'dangerous' slide,'Amazon love God' sculpture plans approved,Guide dog shortage means blind man 'will struggle',Congress slams PM Modi over ‘Rozgar Melas’: ‘PM destroyed lakhs and lakhs of jobs’,The Speaker of the House Says that Big Techs Crossed All Limits in Brazil and Have Kept Congress from Legislating,Uefa insist Champions League final will be held in Istanbul,"No chlorinated chicken or hormone-fed beef in future trade deals, Sunak vows",Virgin Orbit delays bid deadline in scramble to find rescuer
Turkey election: Erdogan faces a presidential runoff but appears ahead of rival,The dark universe: can a scientist battling long Covid unlock the mysteries of the cosmos?,"Ukraine's Zelenskiy, in Britain, wins pledge of long range drones",Biden maintains edge over Trump in 2024 US election -Reuters/Ipsos poll,‘Dirty can opener’ and ‘warm fridge’ found during care home's food hygiene inspection,Fundraising drive for permanent memorial to Newcastle United legend Hughie Gallacher,Hundreds of North East voters turned away from polling stations because of photo ID law,"Man, 36, admits driving Mercedes whilst disqualified",,New owners of burger trailer selling out at pubs and parks across Norfolk,Council ordered to improve planning process,Flood-hit Devon villagers 'supported by community',Slum authority in Mumbai directed to give Rs 300 crore for Dharavi Redevelopment Project,Federal Police Sees Fraud in Bolsonaro's Vaccination Data,UEFA rebuts claim Istanbul in doubt as Champions League final host after election,UK schools minister promises to review Sats paper that left pupils ‘in tears’,All the TV shows and films affected by the Hollywood writers' strike
Islamic Jihad is a threat to both Israelis and Palestinians,Listen to a toadfish’s grunt! AI helps decode a ‘symphony’ of ocean sounds,Senior doctors in England begin voting on strike action in pay dispute,"Biden may skip Australia Quad meet as debt ceiling default nears, White House says",Man arrested on suspicion of drug possession and attempted burglary,Watch rare film footage of Newcastle United v Pele and his team Santos from 50 years ago ,Vote for your favourite North East curry house in our interactive poll,Worcester man fined for driving with unsafe tyres,,Teenage boy charged after fight outside city cinema,Man arrested after two found dead in house,How 20 years of fan ownership is helping Exeter 'do it right',"After recent murder of medico in Kerala, man arrested for attempting to assault another doctor",Brazilian Federal Supreme Court Charges 200 More of the Denounced for Coup-Plotting Attacks of 8/1,A look at the candidates in Turkey's presidential elections,Tory populists have a real enemy in their sights – they’re gunning for the Tory realists ,Largest cosmic explosion ever spotted by astronomers
Businessman arrested after girlfriend hacked to death in luxury Bangkok apartment,Dominic Kwiatkowski obituary,"Piers Morgan knew about phone hacking, Prince Harry's biographer tells court",Biden administration grants Mountain Valley Pipeline permit,Mysterious 'Untitled Goose Game' artwork appears on housing estate - here's why,Former Gateshead factory workers 'left desolate' and unable to pay bills or for Christmas presents after redundancy cash delayed 'until the New Year',Justice for Nikki Allan as monstrous murderer convicted after 31 years of torture for family,Congregation up in arms over move to install 5G tower in front of church,,"Norwich woman’s mum ‘begged’ father to end her life, he tells court",Bus engulfed by flames in suspected arson attack,The cricket fan making bats the traditional way,"Land-for-jobs-scam: CBI searches 9 locations in Bihar linked to RJD leaders Kiran Devi, Arun Yadav","Fake News Bill Unites Lula, Lira and Federal Supreme Court against Big Techs, Bolsonarists and Evangelicals",AP News Digest 4 a.m.,Tory Nation by Samuel Earle review – tangled up in blue,New test made with AI could help doctors diagnose heart attacks faster
Six years trapped at sea: ‘I was beaten with barbed stingray tails and scalded by boiling water’,So pleased to meet you: why it’s never too late to make close friends,"After enduring shortages, Britain to review horticulture and egg supply",Biden vetoes legislation to block solar panel tariffs waivers,Popstar cancels North East gig after crew is involved in 'serious' car crash,Gateshead man's support for powerful project sending toys to kids whose lives were torn apart by war,Coronation street party road closures and events across the North East,MAP: The crimes that have been reported to police on your street,,Norwich pilot 'retires' from 17-year toxic fume battle with airlines,Rob Burrow's wife smashes fundraising goal,Race Across the World pair's special friendship,"‘Some investigations move to punish accused, others to save accused’: Sibal on probe into wrestlers’ allegations against WFI chief",,,Sunak’s push for European court reform on Rwanda flights knocked back,Stars in the making pictured in space images 'no one has ever seen before'
China cracks down on ‘bride prices’ to boost birth rates,Did you solve it? Succession,India's carmakers back zero duty on limited British imports under trade deal - sources,"U.S. charges Apple ex-employee for trying to steal technology, fleeing to China",Popular bakery moves North East branch next door and plans celebration next week,Disney confirms planned closing date for Metrocentre Disney Store,Major Saturday morning shows hauled off air for Coronation as schedule shake-up confirmed,"Magistrates warn thief, 25,  to change her ways or she could end up in jail",,Fostering can make young people feel loved and wanted for the first time,Archer out for summer as England recall Bairstow,Gun review called after inquests still months away,"Govt has simplified recruitment process, ended corruption, nepotism: PM",,,Is Braverman’s call to ‘train up’ Brits to fill shortages possible?,Nintendo bets big on Zelda sequel - with latest instalment met with positive reviews
