world,science,uk,us,teesside,tyneside
'Net closing' on Russian elite as new sanctions target Abramovich and Usmanov fixers,,,,,Police say case of Kieran Williams' unresolved death remains 'open investigation'
Mane punched Sane in face after Bayern Munich's loss to Man City,,,,,Police trying to trace wanted North East man who they believe is evading arrest
"Leak suspect, 21, is a US National Guard airman",,,,,Man hit with crowbar during robbery in North East as police release image of man
Watch the arrest of the suspected leaker,,,,,LIVE: North East railway station reopens and train services resume after storm damage
Leaks show Russian infighting over deaths in Ukraine,,,,,"Autistic students most likely to drop out of university, warns charity"
"Texas dairy farm explosion kills 18,000 cows",,,,,Lauren's story – an autistic student's view of life at university
Tech worker arrested in Cash App founder's killing,,,,,Witness: 'Accused teenager told Tomasz Oleszak he would stab him before fatal blow'
Florida moves to ban abortion after six weeks,,,,,Community 'blighted' by ongoing graffiti concerns as councillors 'angered' by paint
Powerful Cyclone Isla hits Western Australia,,,,,
Space mission to Jupiter's icy moons postponed,,,,,
Norway expels 15 Russians accused of spying,,,,,
Former J-pop idol alleges abuse by famed producer,,,,,
"I'm at home, Biden says during historic Irish visit",,,,,
Iran executions surged to 'spread fear' - report,,,,,
Eight things we've learned from the leaked files,,,,,
Dove or dog: China makes peace while baring teeth,,,,,
Why is US gun lobby group NRA so powerful?,,,,,
Jesus wigs and false bananas: Africa's top shots,,,,,
Homage to a friend wins 2023 Sony World Photography Awards,,,,,
South Florida endures 'life threatening' floods,,,,,
Joe Biden tours his Irish family heritage,,,,,
Watch: Strong winds force plane to abort Heathrow landing,,,,,
Watch: BBC News' interview with Elon Musk in full,,,,,
Watch: Protester tackled during Macron Amsterdam visit,,,,,
